[
  {
    "id": "amber-moth",
    "title": "The Amber Moth",
    "category": "curiosities",
    "era": "Prehistoric",
    "year": -40000,
    "image": "/images/amber-moth.svg",
    "description": "A moth with iridescent wings, caught mid-flutter in a drop of resin and kept intact for millennia.",
    "provenance": "Said to have been recovered from a glacial moraine by a surveyor in 1887; catalogued by the Cabinet in 1902.",
    "relatedArtifacts": [
      "bone-flute-of-the-glacier",
      "whale-ear-bone-bell"
    ],
    "tags": [
      "insects",
      "resin",
      "preservation"
    ]
  },
  {
    "id": "bone-flute-of-the-glacier",
    "title": "Bone Flute of the Glacier",
    "category": "ancient-objects",
    "era": "Prehistoric",
    "year": -38000,
    "image": "/images/bone-flute-of-the-glacier.svg",
    "description": "A three-holed flute carved from a vulture wing bone, still able to produce a clear, haunting note.",
    "provenance": "Found wrapped in birch bark inside a cave shelter; acquired through a field exchange in 1931.",
    "relatedArtifacts": [
      "amber-moth",
      "tablet-of-the-salt-merchant"
    ],
    "tags": [
      "music",
      "bone",
      "cave"
    ]
  },
  {
    "id": "ochre-star-map",
    "title": "Ochre Star Map",
    "category": "scientific-instruments",
    "era": "Prehistoric",
    "year": -30000,
    "image": "/images/ochre-star-map.svg",
    "description": "A painted slab of stone whose dots seem to trace the winter stars above the hunters' horizon.",
    "provenance": "Reported by a shepherd in 1954; its pigment was analysed in 1978.",
    "relatedArtifacts": [
      "sundial-of-the-seven-shadows",
      "astrolabe-of-al-fazari"
    ],
    "tags": [
      "astronomy",
      "pigment",
      "stars"
    ]
  },
  {
    "id": "tablet-of-the-salt-merchant",
    "title": "Tablet of the Salt Merchant",
    "category": "ancient-objects",
    "era": "Ancient",
    "year": -2400,
    "image": "/images/tablet-of-the-salt-merchant.svg",
    "description": "A clay tablet recording a dispute over a shipment of salt, with an apology scrawled in the margin.",
    "provenance": "Recovered from a river-delta archive; transferred to the Cabinet with a bequest in 1911.",
    "relatedArtifacts": [
      "bone-flute-of-the-glacier",
      "antikythera-echo"
    ],
    "tags": [
      "writing",
      "trade",
      "clay"
    ]
  },
  {
    "id": "sundial-of-the-seven-shadows",
    "title": "Sundial of the Seven Shadows",
    "category": "scientific-instruments",
    "era": "Ancient",
    "year": -300,
    "image": "/images/sundial-of-the-seven-shadows.svg",
    "description": "A stone dial with seven gnomons, each telling a different civic hour in a city that no longer exists.",
    "provenance": "Purchased at auction in 1899, provenance traced to a harbour temple.",
    "relatedArtifacts": [
      "ochre-star-map",
      "antikythera-echo"
    ],
    "tags": [
      "time",
      "astronomy",
      "stone"
    ]
  },
  {
    "id": "antikythera-echo",
    "title": "The Antikythera Echo",
    "category": "scientific-instruments",
    "era": "Ancient",
    "year": -100,
    "image": "/images/antikythera-echo.svg",
    "description": "A corroded bronze gear train, a replica fragment hinting at a lost tradition of analogue computing.",
    "provenance": "Cast from a wreck-recovered original; gifted by a diving society in 1960.",
    "relatedArtifacts": [
      "sundial-of-the-seven-shadows",
      "astrolabe-of-al-fazari",
      "clockwork-sparrow"
    ],
    "tags": [
      "gears",
      "astronomy",
      "bronze"
    ]
  },
  {
    "id": "roman-glass-tear-vial",
    "title": "Roman Glass Tear Vial",
    "category": "ancient-objects",
    "era": "Ancient",
    "year": 50,
    "image": "/images/roman-glass-tear-vial.svg",
    "description": "A slender blue-green vial, reputedly used to gather the tears of mourners.",
    "provenance": "Excavated from a roadside tomb; entered the collection in 1923.",
    "relatedArtifacts": [
      "tablet-of-the-salt-merchant",
      "jade-cicada"
    ],
    "tags": [
      "glass",
      "funerary",
      "ritual"
    ]
  },
  {
    "id": "jade-cicada",
    "title": "Jade Cicada",
    "category": "ancient-objects",
    "era": "Ancient",
    "year": -100,
    "image": "/images/jade-cicada.svg",
    "description": "A palm-sized cicada carved from jade, placed on the tongue of the departed as a promise of rebirth.",
    "provenance": "Acquired from a private collector in 1947 with a handwritten label.",
    "relatedArtifacts": [
      "roman-glass-tear-vial",
      "amber-moth"
    ],
    "tags": [
      "jade",
      "funerary",
      "insects"
    ]
  },
  {
    "id": "astrolabe-of-al-fazari",
    "title": "Astrolabe of al-Fazari",
    "category": "scientific-instruments",
    "era": "Medieval",
    "year": 800,
    "image": "/images/astrolabe-of-al-fazari.svg",
    "description": "A brass astrolabe engraved with the names of stars in two scripts, one added by a later owner.",
    "provenance": "Passed through at least four owners before arriving in 1905.",
    "relatedArtifacts": [
      "antikythera-echo",
      "mappa-mundi-fragment",
      "ochre-star-map"
    ],
    "tags": [
      "astronomy",
      "navigation",
      "brass"
    ]
  },
  {
    "id": "mappa-mundi-fragment",
    "title": "Mappa Mundi Fragment",
    "category": "curiosities",
    "era": "Medieval",
    "year": 1290,
    "image": "/images/mappa-mundi-fragment.svg",
    "description": "A vellum scrap showing sea monsters, a dog-headed people, and a quiet corner marked \"here be dragons\".",
    "provenance": "Salvaged from a binding in a monastery library; conserved in 1966.",
    "relatedArtifacts": [
      "astrolabe-of-al-fazari",
      "bestiary-of-impossible-birds"
    ],
    "tags": [
      "maps",
      "vellum",
      "monsters"
    ]
  },
  {
    "id": "bestiary-of-impossible-birds",
    "title": "Bestiary of Impossible Birds",
    "category": "curiosities",
    "era": "Medieval",
    "year": 1250,
    "image": "/images/bestiary-of-impossible-birds.svg",
    "description": "An illuminated manuscript of birds that never lived, with notes on their habits and tempers.",
    "provenance": "Copied in a scriptorium; later owned by a notable naturalist.",
    "relatedArtifacts": [
      "mappa-mundi-fragment",
      "cabinet-of-wax-fruits"
    ],
    "tags": [
      "manuscript",
      "birds",
      "illumination"
    ]
  },
  {
    "id": "plague-doctor-beak-reliquary",
    "title": "Plague Doctor's Beak Reliquary",
    "category": "oddities",
    "era": "Medieval",
    "year": 1348,
    "image": "/images/plague-doctor-beak-reliquary.svg",
    "description": "A leather beak stuffed with herbs and a cloth that still smells faintly of juniper and fear.",
    "provenance": "Found in a cellar during demolition in 1912.",
    "relatedArtifacts": [
      "mappa-mundi-fragment",
      "apothecary-of-lost-remedies"
    ],
    "tags": [
      "medicine",
      "plague",
      "leather"
    ]
  },
  {
    "id": "apothecary-of-lost-remedies",
    "title": "Apothecary of Lost Remedies",
    "category": "curiosities",
    "era": "Renaissance",
    "year": 1560,
    "image": "/images/apothecary-of-lost-remedies.svg",
    "description": "A travelling chest of 40 labelled phials, many of whose ingredients no one can now identify.",
    "provenance": "Inventoried in a merchant's will; found in an attic in 1938.",
    "relatedArtifacts": [
      "plague-doctor-beak-reliquary",
      "cabinet-of-wax-fruits"
    ],
    "tags": [
      "medicine",
      "chest",
      "chemistry"
    ]
  },
  {
    "id": "cabinet-of-wax-fruits",
    "title": "Cabinet of Wax Fruits",
    "category": "oddities",
    "era": "Renaissance",
    "year": 1590,
    "image": "/images/cabinet-of-wax-fruits.svg",
    "description": "A drawer of lifelike wax fruit made to be admired, studied, and (embarrassingly) bitten by the unwary.",
    "provenance": "Part of a princely collection dispersed in the seventeenth century.",
    "relatedArtifacts": [
      "bestiary-of-impossible-birds",
      "apothecary-of-lost-remedies"
    ],
    "tags": [
      "wax",
      "collecting",
      "food"
    ]
  },
  {
    "id": "galileos-lost-lens",
    "title": "Galileo's Lost Lens",
    "category": "scientific-instruments",
    "era": "Renaissance",
    "year": 1609,
    "image": "/images/galileos-lost-lens.svg",
    "description": "A small, slightly cloudy lens ground for a telescope, with a thumbprint pressed into the glass mount.",
    "provenance": "Attributed by letter to a workshop in Padua; arrived in 1920.",
    "relatedArtifacts": [
      "astrolabe-of-al-fazari",
      "orrery-of-the-small-moons"
    ],
    "tags": [
      "optics",
      "astronomy",
      "glass"
    ]
  },
  {
    "id": "orrery-of-the-small-moons",
    "title": "Orrery of the Small Moons",
    "category": "scientific-instruments",
    "era": "Industrial",
    "year": 1790,
    "image": "/images/orrery-of-the-small-moons.svg",
    "description": "A brass planetary model whose clockwork includes moons not discovered for another century.",
    "provenance": "Built by an instrument maker for a country gentleman.",
    "relatedArtifacts": [
      "galileos-lost-lens",
      "clockwork-sparrow"
    ],
    "tags": [
      "astronomy",
      "clockwork",
      "brass"
    ]
  },
  {
    "id": "clockwork-sparrow",
    "title": "Clockwork Sparrow",
    "category": "forgotten-technologies",
    "era": "Industrial",
    "year": 1780,
    "image": "/images/clockwork-sparrow.svg",
    "description": "A tiny automaton that sings, flaps and cocks its head — then falls silent mid-song.",
    "provenance": "Recorded in an inventory of a Swiss maker; arrived in 1928.",
    "relatedArtifacts": [
      "antikythera-echo",
      "orrery-of-the-small-moons",
      "difference-engine-gear"
    ],
    "tags": [
      "automaton",
      "gears",
      "birds"
    ]
  },
  {